{"analysis":{"algorithm_id":"demo-record-count","algorithm_version":"1.0.0","configuration":{"purpose":"mechanics_only"},"random_seed":null},"analysis_code_identity":{"code_and_schema_sha256":"daf04af72a4d4008f691a03a926a43ba232732bdbd5f75eb19430c157eb0e44b","git_commit":"5b873bd18889c8438e3c6d461c1e846db96b0629","git_state":"clean","package_version":"0.1.1","schema_sha256":{"contracts/v1/algorithm-recommendation.schema.json":"a8da243061a06ca44e07389d134e58b336b0c2e4cdc58abd11d1c24a4483c91a","contracts/v1/dataset-manifest.schema.json":"da60b565a01102598c8478b667bb320c544e7ddd095c8b7bdd4bb9cd773947a7","contracts/v1/experiment.schema.json":"4c23ac262b4ddc37737a88b18e600465776124f74949fbb774f56ac2fd769015","contracts/v1/finding-validation.schema.json":"e11faf34a694e4bb798623136a0da02c1024d5d9693ad1a8474cb27a3f1ac52b","contracts/v1/finding.schema.json":"e94555523044f0d02ea7165c91f57e0b4891c074fc2c3a5e92f8b6235412bc8f","contracts/v1/metric-definition.schema.json":"ad7d1101a4d8ce900c4633f20e0256b21bbb34a2eb5eae6098d5cfa7fb7ecfe6","contracts/v1/normalized-manifest.schema.json":"f6216bb6f99cf70b3428f4df6c181619b9b1261297db733309fff902b1f2d993","contracts/v1/normalized-record.schema.json":"74148f59bf39081e59141b906eb37bd0bed5fad6e8ce4a9552820bfe900238f1","contracts/v1/product-export-definition.schema.json":"b2ca27b8ad7a6524c49023d130dcaac877982742c3944e3b5d08ed81c9086c00","contracts/v1/product-export-manifest.schema.json":"db47970dd497a5996e9066ff66c4e42686bf3af201d95f0f96e5f04f99465a0c","contracts/v1/product-provenance-summary.schema.json":"aa495758a7b94e161b7275f3ad2d225aa171af3ce8ec3fb7d71d73d9459cb7d2","contracts/v1/protocol-amendment.schema.json":"95db7de234be1cd941c120f5b4cbc09ffe3a93a2a9007defe8348bac8b563f0e","contracts/v1/protocol-freeze.schema.json":"a483f3ebbc26c8f50c9f703b9ec670eebccb63e89b132304019fd60f6064f88b"}},"computed_evidence":{"comparability":{"criteria_applied":["Schema validity and record linkage only"],"evidence_references":[],"provenance":"unavailable","status":"undetermined","violations":["No real conditions or performance events exist to compare"]},"effect_estimate":null,"exclusions":[],"falsification_attempts":[{"description":"Exercise malformed-input, hash, relationship, and deterministic-output failure cases.","evidence_sha256":null,"outcome":"not_applicable","provenance":"analyst_claim"}],"sample_counts":{"evidence_sha256":"de125c35b2f1b62b31b82cd4044fc438a4289135d005fc8aea9c6a9a19a39832","provenance":"computed","values":{"cars":0,"corners_or_events":0,"drivers":0,"laps":2,"observations":8,"sessions":1,"tracks":0}},"sample_sufficiency":{"criteria_applied":["Synthetic mechanics cannot satisfy a scientific sample design"],"evidence_references":[],"provenance":"unavailable","status":"insufficient"},"uncertainty":{"confidence_level":null,"interpretation":"No inferential estimate or confidence statement was produced.","interval":null,"method":"not_applicable_synthetic_mechanics_demo"}},"created_at":"2026-08-19T00:00:00Z","datasets":[{"dataset_id":"synthetic-mechanics-demo","fingerprint":"533a660c2d8d8e496d8fc5f1081a03affbc40e1d92ef80d0e7689f44038360de","normalized_manifest_sha256":"57213467d6a69ae5184a274457b39f17f18d359f82b85cf7aefae6994909b26f","records_sha256":"de125c35b2f1b62b31b82cd4044fc438a4289135d005fc8aea9c6a9a19a39832","synthetic":true}],"finding_id":"synthetic-mechanics-demo","finding_sha256":"b8e2b36314ac529d7fee79a6a98e6f079cdd0c0906b95dee0e010dbfdc6e3aa4","finding_version":"1.0.0","frozen_protocol":{"freeze_id":"synthetic-mechanics-demo-protocol.freeze","freeze_sha256":"34fc34030e5518dd4d9530cfd05a530f9a4718002c5cc2b8cfadae286ccef175","protocol_id":"synthetic-mechanics-demo-protocol","protocol_version":"1.0.0"},"gate_evaluations":{"reproducibility":"unresolved","scientific":"unresolved","structural":"passed"},"population_validation_design":null,"preprocessing":{"configuration":{"normalized_dataset_fingerprint":"533a660c2d8d8e496d8fc5f1081a03affbc40e1d92ef80d0e7689f44038360de","normalized_manifest_sha256":"57213467d6a69ae5184a274457b39f17f18d359f82b85cf7aefae6994909b26f"},"configuration_sha256":"49932bc82e4e952ca9922cb9b922cdbe06228d83002d2eaba2374e2293420f66","normalization_version":"1.1.0","pipeline_id":"tabular-csv-normalization","pipeline_version":"1.1.0"},"product_review_state":"not_requested","review":{"notes":["Synthetic mechanics validation is ineligible for scientific approval."],"reviewed_at":null,"reviewers":[],"state":"unreviewed"},"schema_version":"apex-labs.finding-validation/v1","scope_assessment":{"design_basis":"Synthetic software fixture only; the scope label prevents any wider inference.","evidence_references":[],"scope":"session_specific"},"synthetic":true,"validation_id":"synthetic-mechanics-demo-validation","version":"1.0.0"}
